claim_type	claim
Interpretation	The same nurse was pictured vaccinating the first two recipients of the Covid-19 vaccine in the UK, despite them being 20 miles apart.
Description	CNN used a photo of one of the vaccine recipients back in October.
Interpretation	The same image of an elderly woman being vaccinated has been used by the media to show a woman called Joan being vaccinated in Manchester and a woman called Susan getting vaccinated in South Africa.
Prediction	The NHS Covid-19 vaccination card will be used to prove who has been vaccinated.
interpretation	“They have been reducing the standards so they can pass the vaccine no matter what”; “It does not prevent transmission”
Prediction	Those administering the Covid vaccines will get £12.58.
